{"schemaVersion":1,"requestId":"fixture-request","revisionId":"fixture-map","sourceBundleHash":"b112381b345152b31db80d179b651477a0466e9a13eeeb79ac98d498914f93d1","briefHash":"9d00b8844c7089f2eea06dece3ea736964e4d6472a54a79926b68594f9dff8a2","provenanceHash":"f33a5177f1556074a347fe578b3a8bbcb3329fcad6f7524c8a3e536046c63b40","regionDecisions":[{"regionId":"water-region","disposition":"KEEP_BACKGROUND"}],"layerPlan":["water"],"semanticBindings":[],"budgets":{"x":0,"y":0,"width":1,"height":1}}
